    1 0.000000000 192.168.186.1 → 239.255.255.250 SSDP 217 M-SEARCH * HTTP/1.1 
    2 1.000659038 192.168.186.1 → 239.255.255.250 SSDP 217 M-SEARCH * HTTP/1.1 
    3 5.443966881 192.168.186.130 → 192.168.186.2 DNS 100 Standard query 0x4d96 A connectivity-check.ubuntu.com OPT
    4 5.448336865 192.168.186.2 → 192.168.186.130 DNS 244 Standard query response 0x4d96 A connectivity-check.ubuntu.com A 185.125.190.48 A 35.232.111.17 A 34.122.121.32 A 91.189.91.48 A 35.224.170.84 A 185.125.190.17 A 185.125.190.49 A 185.125.190.18 A 91.189.91.49 OPT
    5 5.449467227 192.168.186.130 → 185.125.190.48 TCP 74 57346 → 80 [SYN] Seq=0 Win=64240 Len=0 MSS=1460 SACK_PERM TSval=65380485 TSecr=0 WS=128
    6 5.454308077 185.125.190.48 → 192.168.186.130 TCP 60 80 → 57346 [SYN, ACK] Seq=0 Ack=1 Win=64240 Len=0 MSS=1460
    7 5.454335517 192.168.186.130 → 185.125.190.48 TCP 54 57346 → 80 [ACK] Seq=1 Ack=1 Win=64240 Len=0
    8 5.454507800 192.168.186.130 → 185.125.190.48 HTTP 142 GET / HTTP/1.1 
    9 5.454646391 185.125.190.48 → 192.168.186.130 TCP 60 80 → 57346 [ACK] Seq=1 Ack=89 Win=64240 Len=0
   10 5.466138956 185.125.190.48 → 192.168.186.130 TCP 1514 HTTP/1.1 500 Internal Server Error  [TCP segment of a reassembled PDU]
   11 5.466139011 185.125.190.48 → 192.168.186.130 TCP 1514 80 → 57346 [ACK] Seq=1461 Ack=89 Win=64240 Len=1460 [TCP segment of a reassembled PDU]
   12 5.466139035 185.125.190.48 → 192.168.186.130 HTTP 665 HTTP/1.1 500 Internal Server Error  (text/html)
   13 5.466160793 192.168.186.130 → 185.125.190.48 TCP 54 57346 → 80 [ACK] Seq=89 Ack=1461 Win=62780 Len=0
   14 5.466183909 192.168.186.130 → 185.125.190.48 TCP 54 57346 → 80 [ACK] Seq=89 Ack=2921 Win=62780 Len=0
   15 5.466396414 192.168.186.130 → 185.125.190.48 TCP 54 57346 → 80 [FIN, ACK] Seq=89 Ack=3533 Win=62780 Len=0
   16 5.466522849 185.125.190.48 → 192.168.186.130 TCP 60 80 → 57346 [ACK] Seq=3533 Ack=90 Win=64239 Len=0
   17 6.444839747 192.168.186.130 → 35.232.111.17 TCP 74 40644 → 80 [SYN] Seq=0 Win=64240 Len=0 MSS=1460 SACK_PERM TSval=313649765 TSecr=0 WS=128
   18 6.452282891 35.232.111.17 → 192.168.186.130 TCP 60 80 → 40644 [SYN, ACK] Seq=0 Ack=1 Win=64240 Len=0 MSS=1460
   19 6.452331448 192.168.186.130 → 35.232.111.17 TCP 54 40644 → 80 [ACK] Seq=1 Ack=1 Win=64240 Len=0
   20 6.452748969 192.168.186.130 → 35.232.111.17 HTTP 142 GET / HTTP/1.1 
   21 6.453050183 35.232.111.17 → 192.168.186.130 TCP 60 80 → 40644 [ACK] Seq=1 Ack=89 Win=64240 Len=0
   22 6.456228864 35.232.111.17 → 192.168.186.130 TCP 1514 HTTP/1.1 500 Internal Server Error  [TCP segment of a reassembled PDU]
   23 6.456228968 35.232.111.17 → 192.168.186.130 TCP 1514 80 → 40644 [ACK] Seq=1461 Ack=89 Win=64240 Len=1460 [TCP segment of a reassembled PDU]
   24 6.456228985 35.232.111.17 → 192.168.186.130 HTTP 665 HTTP/1.1 500 Internal Server Error  (text/html)
   25 6.456249639 192.168.186.130 → 35.232.111.17 TCP 54 40644 → 80 [ACK] Seq=89 Ack=1461 Win=62780 Len=0
   26 6.456272195 192.168.186.130 → 35.232.111.17 TCP 54 40644 → 80 [ACK] Seq=89 Ack=2921 Win=62780 Len=0
   27 6.456561482 192.168.186.130 → 35.232.111.17 TCP 54 40644 → 80 [FIN, ACK] Seq=89 Ack=3533 Win=62780 Len=0
   28 6.456722046 35.232.111.17 → 192.168.186.130 TCP 60 80 → 40644 [ACK] Seq=3533 Ack=90 Win=64239 Len=0
   29 7.613378787 192.168.186.130 → 192.168.186.2 DNS 86 Standard query 0x7267 A www.youtube.com OPT
   30 7.613575412 192.168.186.130 → 192.168.186.2 DNS 86 Standard query 0xa63d AAAA www.youtube.com OPT
   31 7.614972961 192.168.186.130 → 142.250.185.206 TCP 102 [TCP segment of a reassembled PDU]
   32 7.614998605 192.168.186.130 → 142.250.185.206 TCP 102 42706 → 443 [ACK] Seq=49 Ack=1 Win=63910 Len=48 [TCP segment of a reassembled PDU]
   33 7.615000298 192.168.186.130 → 142.250.185.206 TCP 102 42706 → 443 [ACK] Seq=97 Ack=1 Win=63910 Len=48 [TCP segment of a reassembled PDU]
   34 7.615001126 192.168.186.130 → 142.250.185.206 TCP 102 42706 → 443 [ACK] Seq=145 Ack=1 Win=63910 Len=48 [TCP segment of a reassembled PDU]
   35 7.615001960 192.168.186.130 → 142.250.185.206 TLSv1.2 75 Application Data
   36 7.615137427 192.168.186.130 → 142.250.185.206 TLSv1.2 1265 Application Data
   37 7.615388673 142.250.185.206 → 192.168.186.130 TCP 60 443 → 42706 [ACK] Seq=1 Ack=49 Win=64240 Len=0
   38 7.615388759 142.250.185.206 → 192.168.186.130 TCP 60 443 → 42706 [ACK] Seq=1 Ack=97 Win=64240 Len=0
   39 7.615388780 142.250.185.206 → 192.168.186.130 TCP 60 443 → 42706 [ACK] Seq=1 Ack=145 Win=64240 Len=0
   40 7.615388804 142.250.185.206 → 192.168.186.130 TCP 60 443 → 42706 [ACK] Seq=1 Ack=193 Win=64240 Len=0
